작성일,조회수,직무명,질문 제목,질문 내용,답변 1,답변 2,답변 3,답변 4,답변 5,답변 6,답변 7,답변 8,답변 9,답변 10
2020-06-13 작성,"조회수 4,913",현장관리자 / 강동대학교,차후 진로가 고민되어 남겨봅니다.,"16년 2월경 초대졸(건축과)을 하고, 스펙전무했던지라 자그만한 전문건설업에서 약 3년간 사회생활을 경험하였습니다. 이 과정에서, 건설기술인 초급 / 건설안전기사 합격 을 하여 제 자신에게 스펙을 채워주었습니다. 퇴직 전 마침, 대기업 건설 현채직 면접을 경험하였는데 제 경력이 전문건설업 경력이다보니 딱히 경력도 인정해주지않을뿐더러, 큰 문 턱이 있다는걸 깨달았습니다. 현재 퇴직 후 다시 취준생으로 돌아왔습니다. 내년이면 30인지라, 대기업쪽으로 목표를 잡았는데 토익,자격증 1개 취득예정 우선적으로 필요할 것을 공부하러고 하는데, 건설업계 쪽에서 pjt,현채직으로 들어가 경력을 쌓는게 우선일지 스펙을 쌓아서 공채를 노려봐야할지 감이 안 잡힙니다. 제 주변 지인들에게 물어보면 차라리 공기업쪽으로 방향을 잡고 그 준비하는 동안에 공채도 지원할 수 있으면 도전해봐라. 의견을 남겨주었는데요. 현직에 계신 분들에 현실적인 조언 및 충고를 구하고 싶습니다.","- 얼마 전 U.A.E 원자력 현장 삼성물산 계약직 근무했던 경험으로 말씀드립니다. 제 경험상 대기업 계약직 채용 시 경력을 가장 우선시 합니다. 경력직으로 뽑아야 현장에서 바로 근무가 가능하니... 그리고 현채에서 PJT 계약직으로 전환 시에는 고과와 각종 자격증이 중요하구요. 직종에 맞는 자격증(아무나 가지고 있는 자격증 제외, 건축 전공이라면 건축기사!) 준비한다면 건설 시공사와 공기업도 가능하다고 생각합니다. 대기업 시공사보다는 공기업을 더더더 추천드립니다. 마지막으로 제 기준으로 봤을 때 아직은 젊으십니다. 저라면 스펙을 더 쌓아서 공기업쪽으로 노선을 정할 듯 싶습니다. 경력 때문에 일하다 보면 또 다시 공부하기 쉽지 않습니다. 도움이 되셨길 바랍니다.",현장관리자 / 28년차 - 건설계통은 무조건 경력이 1순위이고 자격과 학력은 자기개발하면 되요. 제조업도 경력이구요. 즉 집에서 놀지 마시고 머든 하면서 자신을 업그레이드 하세요 하루 3~4시간 자도 충분 합니다. 젊어서 견딜수 있을 겁니다 참고로 전 19세부터 27년간 소기업 부터 중기업. 대기업 . 공공기관 공사까지 다니고 있으면서 경력관리와 자격증 그리고 학력을 쌓아보니. 순차적으로 성실히 자신을 업그레이드 하면 40중반이 넘어도 걱정이 없을듯 합니다. 자격증은 기술사급 이상 준비 하시구요. 저까은 경우 자격증이 19개정도 있지만 기술사1개 가 더 크게 인정 합니다. ( 프로필(나이47세) : 회사경력 27년(설계. 제조. 기전. 공무. 건설시공. 감리. 관리 등 10여개 회사 이직). 자격증 기술사외18종. 대학원(석사)졸),현장관리자 / 1년차 - 현장에서 막노동을 하다보면 이와중에도 구지 분류을 한다면 일잘하는사람.일못하는사람.일열심히하는사람 있듯이 이중에 제일 중요한사람은 누구라고 생각하시는지요? 첫쩨 . 일잘는사람 둘째 . 일못하는사람 셋쩨 . 일열심히하는사람 현실에 맞춰 생각하면 내가 어덯게 하면될까하는 답이 나올겁니다,현장관리자 / 16년차 - 공채는 잘 않 뽑아요. 뽑아도 인원수가 적다보니 스펙으로 싸우기가만만치 않아요. PJT로 시작하시는게 좋을거같아요,현장관리자 / 9년차 - 대기업가세요 없으면 노가다 원츄,"- 전문건설업이면... 전문골조업체등 단종업체에서 근무했다는 말같은데요? 그래서 대기업 건설업체의 1군이나 2.3군 업체들은 그 경력을 인정하지 않을겁니다 그것때문에 많은 청년들이 상위그룹으로의 진출에 실패를 하여 실망하고 패배감을 맛보기도 하지요 일단 먼저, 지방 종합건설업체로 들어가서 건축에 대한 전체적인 능력, 즉 시공관리를 기초로 공정.안전.원가.품질관리를 기초로 하여... 현장에 대한 감각을 좀 더 키우면서 때를 준비하도록 하세요 두번째, 초대졸의 학력으로는 12345군 건설업체에서 살아남기 힘듭니다 시간이 되는대로 학사학위를 반드시 취득해야 합니다 (요새 야간대학이 있나 모르겠네?) 세번째, 나이 30이면 그렇게 늦은 나이는 아닙니다. 지방건설업체에 가서 성실한 현장생활을 꾸준하게 하면서 건축시공기술사공부를 하도록 하세요. 1년정도 간절하고 절실한 심정으로 차근차근 공부하면 됩니다 그거 따고 탄력받아서 건설안전기술사 공부하면 공부내용이 비슷하여 취득하기 쉽습니다 네번째, 굳이 대기업이 아니더라도 지방에 건실한 2345군 업체들 많습니다 님의 연고가 어딘지는 모르겠으나, 지역에서 유명한 지방건설업체가 여기저기 많이 있습니다 그곳에서도 님의 출신지 건설업체에서 승부를 걸어도 되는것이지요? 물론, 대기업 건설업체가 봉급도 좀 더 많고 복지도 낫습니다만... 대기업 입사는 상당히 어렵고 입사를 한다하더라도 메년 실시되는 구조조정으로 살아남기가 매우 어려운 실정입니다 그리고, 현채직으로 입사한들.. 계약직이라 언제 정리가 될지 모르는 상황이고 정직직원들과의 보이지않는 차별때문에 패배감과 실망감을 많이 느낄 것입니다 결론은, 기본 자격조건은 스스로 갖추어야 합니다 1. 학력: 최소 학사학위 정도는 갖출것 2. 자격증: 건축공학과 출신은 반드시 건축기사1급은 기본이고, 건설안전기사 필수/ 기술사도 나이 40되기전 취득할 것 3. 어학: 1군이 아니면, 토익. 영어는 후순위 4. 입사: 지방 종합건설업체를 추천 함/ 이후 1.2군으로 jump할 것",현장관리자 / 25년차 - 건설 안전기사를 취득하셨으니 긴 안목으로 건설안전기술사 취득을 권해봅니다 지인이 1군회사에서 안전담당자로 근무하고 있는데 점차 건설에서 안전 관련법령등 강화되고 필수 인원이라 괜찮다 하니 생각해보시길,"현장관리자 / 26년차 - 전문건설업에서 1,2군건설사 취업하기쉽지않을듯합니다 제가일하는업종에서는 1군건설사 전문분야담당 파트장으로 간분이 몇분이있기는합니다만 주로 설계특출자로압니다 노력,최선,고생은 상당하다고들었습니다. 30이면 계획했던일이든 무엇을도전해봐도좋지만 본인의 기술력으로 1군건설사에가서도 자신있단 확신이든다면모를까 세상은 호락호락하지않고요 분명 배움의 차이도느낄겁니다 건문건설업 어떤분야인지는잘모르겠으나 30에 차근히경력쌓으면서 하시던직종에서 연봉인상쪽은어떠신지 먹고사는게 문제가되지않는다면 자기분야에서 성실히일하다보면서 소확행즐 즐겨보심이어떨런지요.",,
2022-09-29 작성,"조회수 4,921",품질관리자 / ㈜케이씨텍 / 강원대학교,공정기술에서 하는일이 궁금합니다.,㈜케이씨텍 2022년 하반기 (주)케이씨텍 각 분야 신입/경력 대규모 수시채용,- 설비 관리 및 생산 관리인듯... 설비는 기본 운영 및 사소한 트러블 해결 또는 엔지니어 콜해서 처리하면 되고 생산 관리는 제품이 불량없이 생산할수 있도록 직원을관리,생산직종사자 / 18년차 - 제품에 맞는 베스트 공정 개발 및 경쟁력 있는 cost를 위해 예상 물량 기준으로 manual/semi auto/automation 공정 개발 및 검수.평가 후 양산 팀에게 이관하여 초기 고객사 감사 및 생산성 관리.,"품질관리자 / 29년차 - 상산공정설계, 생산체계구축, 공정 일련의 개선 자재입고부터 생산 출하하는 모든 과정을 설계하고 생산 시스템 체겨구축. 표준 m.h 설정 및 분석 을통한 개선 사항 계획수립 실행 등등 제조 과정의 모든 과정을 관리 개선하는 업무를 말합니다 제조업의 꽃 이죠",품질관리자 / 16년차 - 생산공정중에서ㅡ개선할수있는 방법을 찾고 잘못돼여진 공정도 바로잡는 역할이라봅니다.,6년차 - 생산라인에 길을 여는 일을 합니다. 시스템엔지니어링 생각하시면 되겠고 건축기술도 조금 가지고 있습니다,"품질관리자 / 17년차 - 생산공정상 일어나는 문제를 해소하는 역할입니다. 그리고 공정의 개선, 설계도 해당됨",,,,
2020-05-22 작성,"조회수 4,918",공기업·공공기관,공기업은 정말 평생 직장인가요?,공기업이 좋다고 많이 들었습니다! 평생 직장이 될 수 있을 정도로 안정적인 편인지요? 그리고 신입인 경우 스펙이 엄청 뛰어나야 입사 가능한지요?,경영·비즈니스기획 / 3년차 - 공기업 비영리기관으로 평생직장으로 굉장히 안정적이고 수익이 보장된 기관임엔 틀림 없습니다 하지만 고스펙을 굉장히 수반함에도 틀림 없을겁니다 보통 서류전형부터 시작한다면 이름좀 있다 하는 공기업 공기업은 진흥원 센터 협회 연합회등으로 구분되는데 원급의 공기업의 경우는 현재 500:1이라는 슈퍼스타케이와 같은 형태로 뽑고있습니다 서류전형부터요 제사례를 드리자면 저는 센터급 공기업에서 2년동안 계약직원으로 일했었습니다 총 270명 이상이었고 계약직은 50명 이상이었죠 그중 팀당 신입직원은 1명 있거나 없거나였고 거의 계약직원으로 채워져 있습니다 계약직의 형태는 여러가지입니다 체험형인턴 부터 시작해서 일반인턴 일반계약직 자체계약직 파견계약직 대체계약직 등등이 있죠 정규직은 무기계약직부터 정규직으로 구분됩니다 일단 본론부터 말씀드리자면 고스펙이라고 꼭 공기업에 입사할수있는건 아니구요 내부에 계약직원중에서도 무기계약이나 정규직으로 입사지원 하고있고 아무래도 같은 팀원이나 필요한 인원이 계약직에 있다 지원하면 가산점주고요 실제로 1년이상 계약으로 근무하면 가산점이 주어집니다 1점에서 3점정도요 모집요강에 나온것도 보신적 있으실꺼구요 제주변 같이 공기업 계약직하거나 준비한 인원중 공기업에 입사한 경우는 굉장히 드뭅니다 전문인력으로 지원하면 경쟁률이 낮아 갈순있을거에요(변호사 회계사 자격증 이나) 관련 기사자격증(정보처리기사 등) 기능사는 제외입니다 기능사 가진인력도 너무 많네요 잘알아보시고 전문인력쪽으로 지원은 추천드리지만 일반행정같은 비전문인력쪽은 비추입니다 열심히 준비하셔서 취뽀하세요,"- 공기업 근무 여건 급여 보수 정년이 보장 되기에 안정적이라고 할수 있다 봅니다 특히 입사히고 싶은 인기 있는 공기업 경험 경쟁률이 상당히 놓은 것 보면 알수 있으,리라 봅니다. \","6년차 - 네 공기업은 신의직장이죠 평생직장입니다. 본인 적성에 잘 맞으면요 공기업은 채용직무에 따라 스펙이 나뉩니다. 일단 토익은 기본이고, 경력직은 토익이 없어도 되고, 이 또한 직무에 따라 틀리구요 시험을 잘봐야합니다.",경영·비즈니스기획 / 13년차 - 스펙이 어마무시한데 들어간다고 편하다고좋은것만은 아니더라구요,사무보조 / 5년차 - 스펙보단 경력 그리고 사람들과 잘어울리는지 봅니다. 정치질잘하면살아남구요 아니라면 노조에 시달리죠 그거때문에 이직율도 높구요,"네트워크엔지니어 / 16년차 - 공기업도 공기업 나름입니다. 또한 공기업 안에 좋은 보직으로 들어가야... ㅎㅎ 지방공기업, 국가기관 산하기관 중 신생기관, 협회 등은 중소기업 보다 못합니다 ~ ㅋ 공기업도 힘들어서 퇴사하는 사람 많습니다.","- 대부분 공기업 취준생들이 아는 공기업들은 왠만하면 잘리지 않으나 회사 내규에 따라 아닌 곳도 있다고 들었습니다. 물론 그런 곳은 사람들이 잘 모르는 공기업들이구요. 보통 넘사벽의 대기업 (삼성전자, SK하이닉스) 등을 제외한다면 한전 같은 메이저 공기업들이 오히려 요구 스펙이 높습니다. (토익, 스피킹, 기사, 컴활, 한국사 등) 코레일 같은 곳은 기사 2개 이상 가점이 들어가기도 해서 쌍기사가 유리한 점도 많습니다. 워라밸, 안정적인 고용 상태를 원하는 추세이기 때문에 경쟁률은 점점 오를 것이라 생각합니다.",회계담당자 / 12년차 - 안정적일거라 생각은 했습니다. 이왕이면 저도 공기업에 다니고싶다는 희망사항 이었구요. 스펙은 잘모르겠네요.,2년차 - 엄청 뛰어날 필요는 없어요 남들이 갖추는 토익 한국사 컴활 공기업에서 요구하는 전공자격증만 갖추고 ncs 대비하고 자소서만 잘 쓰면 돼요,"생산직종사자 / 5년차 - 공기업은 고졸전형으로 뽑는 채용과 일반 채용, 블라인드 채용이 있습니다. 고졸전형과 블라인드 채용은 스펙이 뛰어나다기 보다는, 자기소개서를 어떻게 잘 쓰느냐에 따라 달리기 때문에 크게 걱정하실 필요는 없구요. 공기업 직원이 준공무원 대우를 받기 때문에 노후준비나 복리후생 좋습니다."
2018-08-29 작성,"조회수 4,896",전주대학교,전공이 많이 중요할까요..,고등학생 때는 교사가 되고 싶어서 사범대를 진학했고 대학교에 진학하니 과가 나와 맞지 않음을 깨달았어요. 고등학생 때 하고싶은게 무엇인지 내가 뭘 잘하고 좋아하는지 경험할 수 있는 폭은 너무나도 좁았는데.. 올해 졸업하고 교육과를 전공 했던 터라 컴퓨터 관련 자격증은 하나도 없었죠. 이런 제가 중소기업과 같이 어떤 회사에라도 취직이 가능할까요? 월급이 중요하지 않다면 거짓말이지만 차근차근 회사에서 경력을 쌓아서 사회생활 하는게 스스로가 성공할 수 있는 가장 빠른 길 인 것 같은데. 저를 받아 줄 회사가 있을까요? 전공무관이라고 하지만 확실히 신입생 보다는 경력직이 더 우대되긴 하니까요.,7년차 / 05학번 - 저도 인문계 출신에 영교인데 인사노무업무 하다 지금은 직업 수명 늘려보려고 이직해서 QA 하고 있습니다. 자신감을 가지고 도전해보세요!,7년차 / 08학번 - 국비지원 교육을 해보세요.,"4년차 / 03학번 - 우선, 하고 싶은 일이 무엇인지.. 아니면, 목표로 하는 연봉이나 그런 세부적인 것들을 먼저 정하시고, 학원을 다니면서 그쪽으로 공부를 따로 하시든, 관련 자격증을 취득하시든, 알바를 그쪽으로 해서 경력을 쌓으시든.. 아직 어려서 충분히 자신감있게 도전 하셔도 될거같아요~ 힘내세요!",6년차 / 03학번 - 14학번이면 몇살이죠?? ;;; 아~ 제가 늙었나 이제는 계산을 해야하네요 ㅎㅎ 사회 선배로써.. 그리고 대학 선배로써.. 저도 비슷한 경험을 한적이 있습니다. 과에서 배우는것이 나와 맞지 않다라고 느끼고.. 저도 전공과는 다른 일을 하기 시작했습니다. 첨엔 시행착오를 많이 겪었죠.. 어려서 욱해서 그만뒀을때도 있고.. 또 내가 듣던것과는 많이 달라 그만둔적도 있고.. 악덕 상사 만나서 그만뒀을때도 있고.. 그런데 지금와서 생각하니 그것조차 경험이 되더라구요.. 경력직을 우대하는곳이 많죠?? 신입들은 어떻게 살라고.. 하지만 신입을 뽑는곳도 은근히 많습니다. 돈 중요하죠.. 복지 중요하죠.. 허나 본인이 돈만 쫓다보면 5년하면 지칠꺼 1~2년하면 지칩니다. 그리고 또 다른일 찾겠죠.. 그게 반복이예요.. 정말 본인이 좋아하는것을 찾으세요.. 그리고 아직 어리니.. 그것에대해 공부하고 알아가세요.. 그리고 본인이 만족할 수준은 아니지만 그래도 괜찮다하는곳에 들어가서 일을 배우고 자격증도 따고 하세요.. 그러다 보면 어느새 본인이 경력자가 되어있을겁니다. 그리고 직장 선택의 폭이 지금보다 넓어질꺼예요.. 걱정하지말고 도전하세요.. 젊음이 진짜 좋은겁니다. 그땐 넘어져도 일어설수 있어요.. 이런 고민을 하는 사람이라면 충분히 도전해서 성취하실꺼라 봅니다. 화이팅하세요..^^,15학번 - 음... 일단은 경력직 우대라는 생각을 버리시고 도전해보면 좋을 것 같아요 너무 부정적으로 생각하는 것 보다. 일단 도전 해 보는 게 중요하다고 생각합니다. 도전해보지도 않고 낙 심 하는 것보다 일단은 전진해보세요,2년차 / 07학번 - 요즘 같은 시대에 전공이 그렇게 중요치 않다고 생각합니다. 물론 전공분야에 들어가면 안배운것보다는 도움이 되긴하겠죠.. 어떤 직무를 원하시는지 적어놓질 않아서 뭐라고 설명하긴 힘들지만 뭐든 배우면 어떤 상황에 다 써먹을수 있으니 걱정하지 말고 자신있게 도전해보세요!^^,"2년차 / 10학번 - 영문학과인데 해외대기업 계열사 레스토랑에서 쉐프로 1년 근무하고 정부기관 공학연구소에서 2년 근무하다가 지금은 공기업 경영지원에서 일하고 있습니다. 열심히 연봉 쫓아서 일하다보면 잡케가 되어버리는 것 같습니다. 지금까지 계속 정규직으로 다녔구요. 지금은 마음에 드는 곳으로 오게되어서 오래 있을 예정이에요. 저는 이직대비해서 정보보안과 시설관리 공부를 하고 있습니다. 준비된 사람이 기회도 잡는 법이니까 자신을 위한 공부 꾸준히 하다보면 좋은 기회가 찾아올 거에요. 그러므로, 현재와 미래를 걱정하기보다 걱정이 사라질 정도로 절박하게 앞만보고 미래를 쫓아다니세요.","9년차 / 03학번 - 남에 의견이 얼마나 도움이 될지는 모르겠네요. 뭐할까 고민할시간에 뭐라도 하세요. 알바라도~ 성공 공식은 각자가 다 달라요. 저도 제 나이치곤 차고넘치게 벌고 있지만 지금 후배들이 제가 했던데로 한다고 해서 저만큼 될지는 저도 알수가 없어요. 책보는 습관 만들고 공부하세요. 공부가 시험치는 공부 말고 소설도 좋으니 책읽는 습관을 만들어서 본인이 찾고싶은 답은 책에서 찾도록 노력하세요. 남들이 하는 경험 별 도움이 안되요 심지어 제가 쓰고있는 이 답변도, 지금까지 달린 답변도 어차피 어떤사람들인지 알지도 못하는 사람들의 글들을 가지고 인생의 큰 결정을 한다는건 어리석겠죠? 책 보세요~ 책에서 답을 찾는 습관만 가지면 엄청난 사람이 되어 있을겁니다.",4년차 / 09학번 - 전공을 살리는 사람은 20%정도 입니다. 저도 디자인을 전공했지만 적성에 안맞아서 경영지원으로 진로를 바꿨고 올해 5년차가 되었습니다. 회사에서 전공보단 일을 잘 할수있는지 능력을 봅니다.,"5년차 / 99학번 - 안녕하세요. 저는 99학번 환경과를 졸업했습니다. 현 CJ 글로벌팀 소속으로 해외에서 근무중입니다. 물론 전공하고는 상관 없습니다. 환경과를 전공해서 현 M&A 후속단계를 진행 하고 있으니까요. 한국에서 전공과 연관된 회사를 취업 하면 좋지만, 그런 사람이 몇이나 될까요..? 물론 회사내 많은사람들이 전공과 연관된 일을 하고 있어서 더 빨리 인정 받고 있는건 사실입니다. 하지만 저처럼 전공을 포기할수 밖에 없는 사람은 회사내에서 자신만의 분야 혹 장점 혹 특기를 만들기 위해 새로운 공부를 해야 합니다. 그리고 설사 전공과 연결된 일을 한다고 해도 더 다양한 공부는 필수 입니다. 그렇지 않고서는 살아남지 못하기 때문 입니다. 취업이 하고 싶나요! 취업은 욕심만 버리면 당장 오늘도 구할수 있다고 생각 합니다. 완주 공단 가보세요! 일자리 많이 있습니다. 하지만 자신이 어떠한 목표를 가지고 있는지 묻고 싶네요. 그러고 그걸 위해서는 지금부터라도 무었을 해야 하는지 먼저 생각 해보면 좋을것 같습니다. 부디 늦었다고 생각하지 말고 하루동안 곰곰히 생각하고 다음날 바로 시작하세요! 늦지 않았습니다."
2020-08-23 수정,"조회수 4,907",회계담당자 / 장안대학교,법률사무원으로 취직할 예정인데 궁금한점이 있습니다,여자이고 28세 초대졸 행정법률과 졸업 경력은 생산직이 대부분이며 세무사무소에 3개월 근무한 경험이 전부입니다 대한법률학원에서 국비교육으로 수료후 취업할 예정인데요 제가 문제는 면허증이 없습니다 도로주행시험보다가 뒤에서 화물차가 박는바람에 도저히 용기가 안나요 정리하자면 면허증은 없고 전산회계1급 자격증이 전부인 제가 법률사무원이 될수있을까요?,"11년차 - 법률사무원과 면허증은 관계 없습니다. 로펌의 법률사무원을 보통 스탭라고 하는데, 아무래도 로펌의 메인은 변호사들이고 법률사무원은 그 변호사를 사무보조하는 업무를 합니다. 그래서 법률사무원은 단순 사무보조의 업무만으로도 충분히 이루어 낼 수 있습니다. 다만, 법률사무소 혹은 로펌 마다 다르게 경력이 오래 되거나 잘하시는 분들은 소장, 답변서 등 변호사의 업무의 초안까지 미리 해서 변호사에게 컨펌 받곤 합니다. 변호사가 모두 다 해야하는 것이 원칙이나 일이 많다 보니 소장이나 답변서 등의 초안은 법률사무원이 작성하는 경우가 많습니다. 이런 법률사무소 혹은 로펌에서는 단순사무만의 업무로는 법률사무원이 될 수 없겠지요. 정리하면, 법률사무원의 수준은 차이가 큽니다. 잘하는 사람은 거의 변호사급으로 법원에 언제 무엇을 제출해야하는지, 관련 법률도 잘 알고, 무엇이라고 답변하면 의뢰인이 유리할지 까지 잘 알고 있습니다. 하지만 초보나 경력이 짧은 사람들은 시키는 문서수발 정도만 하는 경우가 있습니다. 님을 사회 초년생으로 보면 법률사무원의 경력이 없으니 법률사무소 혹은 로펌에서 엄청난 요구를 하지 않겠지요. 젊음과 세무사무소 및 수료교육으로 충분히 얕은 법률사무원으로의 취업은 가능하리라 봅니다. 다만, 법률사무원이 되어서 많은 노력을 기울이지 않으면 계속 살아남기 쉽지 않을 수도 있습니다. 님이 법이나 법률에 관해 경력이 없다 보니.","사무담당자 / 3년차 - 법률사무원은 말그대로 변호사의 법률적인 업무를 보조하는 사무원이라, 관련 법무법인이나 개인사무소 업무가 아니라면 인정해주지않아 어차피 신입으로서 들어가게 되실 것 같습니다. 저 또한 법무관련 전공도 아닐 뿐 더러 입사하게 되었었는데요. 그 당시 면허증, 자격증 1도 없이 성실하나로 입사했던 것 같습니다. 무엇보다 전산회계는 회계 관련 업무의 연장선이라 인정 받지 못할 확률이 높아요. 입사 자체는 굉장히 쉽습니다. 저도 그랬고 주변 학원 다녔던 당시의 동기들도요. 그렇지만 생각보다 서비스업종이기에 사람에 대한 스트레스가 굉장히 높습니다. 그리고 사람 취급 안해주는 곳도 많구요. 그걸로 주변 동기분들 중 이 길을 포기하신 분들도 많아요 저 포함해서 그 부분도 고려하시고 입사하시면 좋을 것 같아요. 얇고 길게 가기 좋지만 그만큼 법률적인 공부를 한다면 더 나은 상황이 될 수도 있어요.",사무보조 / 3년차 - 하면된다 아자 아자 화이팅,,,,,,,
