작성일,조회수,직무명,질문 제목,질문 내용,답변 1,답변 2,답변 3,답변 4,답변 5,답변 6,답변 7,답변 8,답변 9,답변 10
2020-09-24 수정,"조회수 5,342",무역사무원 / 부산여자대학교,회사면접관이 면접제의하고자 연락을 했는데 구직자연락이 안된다면?,"구직중인데요 저도 제가 이해안갈 정도로 우울증에 모르는 새로운것에 두려움이 많아 심리적으로 위축되어 있어서인지 전화 가 오면 일단 겁이 납니다 ㅠ 보통 대출전화나 카드 이런 전화도 있어서 스팸전화 걸러주는 앱 설치하면 왜 대출안내, 설문조사 이런거 뜨면 무조건 잘 안받구 확인된 번호 아니면요.. 보통 일반전화도 혹시나 하는 맘에 안받구 핸드폰번호거나 070으로 시 작된 번호 뜨면 무서워서 일단 바로 전화를 안 받구 거절 메시지로 지금 현재 받을수 없어 문자로 연락부탁드린다 전화 드리겠 다라는걸 보냅니다. 근데 문자로 답이 올때도 어쩌다 있지만 대부분 걍 두어번 연락 온 후 전화나 문자가 없더라구요 입장을 바꿔서 내가 면접관이구 이 사람 이력이 맘에 들어 면접보고싶어서 전화를 했는데 두세번 전화를 끊거나 안되면 전화받을 상황이 아닌가 하구 문자로라도 면접볼 의향있냐 있으면 연락달라구 하지 않을까요? 면접보고자 했더니 구직자가 전화가 안되거나 문자로 보내달라 하면 걍 이사람은 건너띄우고 다른사람 전화 해버리나요 ?",- 보통 전화를 안 받으면 문자를 남기거나 하겠죠. 사측에서 면접 제의를 하는데 계속 전화 연락이 안 되면 우선 건너뛰기는 할 겁니다. 연락이 잘 안 되는 사람이 신뢰가 가진 않으니까요.,해외영업 / 18년차 - 아니요. 문자라도 보냅니다. 전화 안 받는다고 더이상 연락 안오는 업체는 처음부터 그다지 뽑을 의지가 없었던 거겠죠~,게임개발자 / 6년차 - 전화 안받으면 메일로 보내겠죠뭐 메일보냈는데도 회신없거나 연락없으면 거르구요 그리고 다른사람 전화는 님이 받든 안받든 다 돌릴거에요 그리고 제대로 연락되는 사람을 면접 부르겠죠.,무역사무원 / 3년차 - 아마도 ㆍㆍㆍ 첫판부터 연락이 안되면 스킵할듯해요,무역사무원 / 8년차 - 네 왠만하면 구직중이실때는. 받아주시는게좋아요,영업지원 / 25년차 - 전화 안받으면 신경은 쓰이겠지만 그래도 전화를 1시간 단위로 계속 해보세요. 한 2~3일정도요. 그래도 연락이 없다면 이번 면접은 나와는 인연이 아니구나 생각하시는 편이 낫습니다.,영업지원 / 2년차 - 아마 그 후로 한 번 정도는 전화로 다시 연락할 것 같은데 안 되면 어쩔 수 없이 다음 지원자로 넘어갈 것 같아요...,무역사무원 / 15년차 - 보통 면접제의를 전화로 해서 연락이 안되면 꼭 면접을 보려고 했던 사람이라면 문자라도 남기니 염려안하셔도 될거 같네요,,
2023-05-15 수정,"조회수 5,411",건축·설비·환경,근로계약서 작성은 언제쯤 하나요?,이번달이 입사 두달차 여러가지 이유로 퇴사를 하려고합니다 근데 근로계약서를 아직 쓰지않았는데 수습기간이라 쓰지않아도되는건지 궁금해서 질문드립니다 보통 언제쯤 쓰나요? 그리고 계약서쓰지 않아도 퇴사할때 문제가없나요?,생산직종사자 / 20년차 - 수습직원도 보통 입사 첫날이나 아무리 늦어도 1주일 안에 작성 하라고 회사에서 얘기를 해야 정상입니다. 입사 두달차동안에도 근로계약서를 쓰지 않았다면 정상적인 마인드를 가지지 못한 사업주가 맞습니다. 퇴사 결심한거는 잘 한 결심입니다. 어색하거나 주늑들 필요없는 겁니다. 찾아보면 정상적인 회사 아주 상당히 많습니다. 퇴사할 때 문제가 되는건 근로 계약서작성도 안하고 업무를 시킨 사업주가 문제가 될 겁니다. 님에게는 해로운거 전혀 없습니다. 근로계약서 작성을 늦추는 거에 대한 동의를 회사에서 님께 구두적 동의를 받았다 하더라도 효력은 없습니다. 퇴사후 근로복지공단에 민원 제기해 놓으셔야 저런 회사들의 수가 적어집니다. 귀찮다고 그냥 똥밟았네 하고 무시하면 같은 일이 계속 반복 된답니다. 사회에 기여하는 소소한 일도 하시면서 정상적 직장을 찾으시면 좋은 사업주를 만날 가능성이 높아지겠죠......세상은 넓고 할 수 있는 일도 많답니다...힘내세요..파이팅!!,시공기사 / 13년차 - 당일/다음날씁니다. 최대 일주일안으로 써야하는데 두달째에도 안쓰는 회사라면 이상합니다. 임금정산할때 야간수당 및 중식대와 같이 수당이 정산이 어려울수있습니다.,"인바운드상담원 / 5년차 - 안녕하세요. 보통 근로계약서는 입사 후 일주일내 작성합니다. 체계적인 회사는 입사한 날 바로 작성하고, 조금 늦어지는 회사는 일주일내 작성합니다. 수습기간도 근로계약서 작성 대상입니다. 회사가 요청하지 않고, 질문자님이 필요가 없다면 작성하지 않아도 퇴사할 때 문제가 없습니다. 다만, 사람 일은 모르기 때문에 질문자님을 위해서라도 근로계약서는 받아두시는 것이 좋습니다.",시설관리자 / 24년차 - 네,"현장관리자 / 12년차 - 근로계약서는 회사와 직원의 약속 같은것입니다 만약 퇴사시에 월급등으로 문제가 발생시에는 근로 계약서가 없을 시에는 무조건 근로자의 편을 들어주도록 되어있습니다 퇴사시에는 맘편하게 퇴사하시고 월급등 미지급 금액이 있을시에는 관할 노동부가서 신고하면 받을수 있습니다 보통 노동부신고시 1,2,3차 조정을 받습니다 언제까지줄건지 얼마를 줄건지에 대한 조정이며 시간은 걸리긴하지만 받을수는 있으니 퇴사에대한 고민은 그만하세요 ^^",전기기사 / 3년차 - 우리나라 문제점중 하나죠 쉬쉬하면서 넘어가기 빠른시일내로 근로계약서 작성해달라고 부탁드려보셔야 할 것 같아요.,MD / 2년차 - 근로계약서는 입사하자마자 쓰는게 보통입니다 두달차가 됐는데도 안 썼다니.. 회사에 문제가 많아보이네요 확실히 요구해서 계약서 작성하시고 퇴사도 문제없이 하시길 바랍니다,,,
2022-11-17 작성,"조회수 5,358",웹개발자,국비 학원 선정하는데 두곳중 어느곳이 좋을까요?,우선적으로 저는 비전공자이며 개발에 무지합니다 당연히 2년이상 과정들을 반년 속성으로 배운다라는것이 어려울것을 각오하고 가보려합니다 기초만 최대한 챙겨서 웹개발 백엔드 분야로 우선적으로 취직을 노려보고 추가적으로 계속 공부할 계획입니다 1번 학원 커리큘럼과 강사스펙입니다 5년인증에 현업에 10년 가까이 일하셨던분들로 이루어져있다고 들었습니다 2번 학원 커리큘럼과 강사스펙입니다 1년 인증이 있습니다 강사분들의 현직 경험은 아직 모르겠네요 위와 동일하다는 기준하에 조언 부탁드립니다 곧 방문 상담을 하여 이것저것을 물어볼껀데 개발분야에 무지하다보니 어떤것을 확인해야하는지 모르겠습니다 해당부분도 조언을 주시면 너무나 감사할꺼 같습니다,"웹개발자 / 2년차 - 국비 돈을 받으면서 배우고 싶은거라면 전 그나마 2번 추천드립니다. 그리고 개인적인 공부하는걸 추천드리고 + JPA까지 해보는걸 추천드려요. 그리고 국비교육같은경우 깊이 있게 교육하는 경우를 거의 못봤습니다. 돈에 여유가 있다면 차라리 부트캠프를 추천드리는데 자신과의 싸움이다보니, 확신 가지고 계속할수 있겠으면 추천드립니다.",2년차 - 두개 놓고 비교하자면 2번이 나아 보이는데 시간 금전의 여유가 되신다면 독학으로 스프링 기반으로 게시판 구현해보시고 jpa가 커리큘럼에 포함된 교육과정 찾아보시는걸 추천드립니다,"네트워크엔지니어 / 8년차 - 저도 국비출신입니다 저라면 1번 선택할 것 같습니다. 스프링프레임워크를 목적으로 교육받는게 좋아보입니다. 저도 이제 막 수료하고 취업준비중이지만 교육과정을 거치면서 느낀건 강사가 잘가르치는것도 좋지만, 거의 대부분은 스스로 공부해야 합니다. 예를들면 학창시절 수학시간에 아무리 좋은선생, 과외를 받아도 본인이 공부안하면 실력이 안늘고 아무리 영어를 잘배워도 본인이 직접 작문하고, 연습하고 스피킹하지않으면 실력이 안느는것처럼 코딩도 결국 자기자신과의 싸움이라고 생각합니다. 그래서 강사의능력도 중요하지만, 자기스스로 얼마나 많이 공부하는지가 더 발전가능성이 있기 때문에 이것저것 다 찔러보면서 배운다고 다 할 수 있는게 아니기때문에 정확히 내가 뭘 해야겠다 라는 목표하나 정하고 교육받으면서 스스로 공부하는게 답이라고 생각합니다. 같은 시간을 교육받았지만 진짜 존재합니다. for문도 못돌리는.. 사람이.. 그리고 10년차 선배님이 달아주신것처럼 딱 저기 언급된 커리큘럼이 가장 좋아보입니다.","웹개발자 / 10년차 - 1번에 왜 안드로이드가 있는지... 2번에 왜 넘파이와 파이썬이 있는지요...? 저런 부가적인 것 보다, HTML, CSS, Javascript, UML, 객체설계, DB, Java, Spring 및 Spring Boot, MyBatis, JPA가 있는 커리큘럼을 찾아보시는 것이 어떨까요? 부가적으로 TDD나 적어도 유닛 테스트(JUnit 5)를 가르쳐달라고 해보세요!",웹개발자 / 3년차 - 국비 교육은 커리큘럼이 거기서 거기고 찍먹 수준이라고 생각하기 때문에 교육 받으면서 스스로 더 깊이 해보는게 중요한거같아요 저기서 시키는 프로젝트로 끝나는게 아니라 더 깊이 들어가서 혼자 먼가 만들어 보면서 공부도 하고 그런걸 포트폴리오에 녹이는게 더 중요한거같아요. 저라면 집이랑 가까운 곳으로 가고 배우면서 개인 공부를 더 많이 할거같아요,웹개발자 / 5년차 - 커리큘럼은 확실히 1번보다 2번이 확실히 좋습니다. 트렌드에 맞춰서 구성한게 보이네요. 기간 안에 가능한지는 솔찍히 모르겠습니다만...,생산직종사자 / 6년차 - 요즘 국민 배움 카드가있읍니다.배우고자한다면 국민배움카드 이용하여 공부하시는것을 추천드립니다.년간 500만원의 지원금 한다 합니다.알아보시고 사용 해보시는거이 어떠할까요.,"기술·전문강사 / 17년차 - 현직 강사입니다. 1번을 선택하세요. 쿼리는 2번이 더 좋으나 비전공자분이 하시기엔 너무 힘듭니다. 1번도 솔직히 따라갈지 못갈지 모르는데 2번은 너무 무리입니다. 그리고 강사 어쩌구 로또 어쩌구 믿지 마시고, 본인이 열심히 하시면 됩니다. 다 취업됩니다. 현직에서 학원생을 뽑을때 무슨 대단한 경력자 뽑는거 아닙니다. 아시다시피 대기업 가실분들.. 학원 커리로 틀립니다. 저 쿼리는 그냥 웹개발자.. 뽑는 곳에 가시기 딱 좋은.. 보통 SI라고 하는 그런곳에 딱 어울리는 쿼리 입니다.","웹개발자 / 3년차 - 비전공자 국비교육으로 시작했는 데, 커리큘럼 다 똑같습니다~ 레거시 스프링, 마이바티스, jsp, 제이쿼리, 메이븐, 오라클 등등.. 이름만 다르고 그에 대한 건 하루이틀 배우고 끝내요. 2번 커리큘럼에 그나마 aws가 있어서 나은 데 문의해보시고 못할 수도 있다 하시면 가까운 곳으로 가세요. 일단 멀면 지쳐서 가기 싫어져요. 강사도 수업 들어봐야 압니다. 본인이 아는 거랑 남을 가르치는 건 다르더라구요.",앱개발자 / 17년차 - 전산 개발은 잘 하는 것보다 좋아 해야 할 수 있는 일입니다. 취업 벽이 낮다고 접근하면 고생합니다.
2020-05-18 수정,"조회수 5,338",사무담당자,유치원 교사(or보육교사) vs 사무직,"안녕하세요 3년제 전문대학교 유아교육과를 졸업한 후, 바로 취업을 했습니다. 아이들은 좋지만, 아이들을 좋아한다는 것만으로 굉장히 힘든 직업이라는 것을 알게 되었습니다. 6시 정규 시간까지 아이들을 돌보고난 후 퇴근하고 집에가서 학부모에게 전화를 돌리고, 서류작성을 하고 수업을 준비하면 새벽이 됩니다. 이것을 매일하다보니까 너무 우울해져서 1년을 못 채우고 퇴사를 했습니다. 그러다가 공기업 준비를 1년 넘게 하게 되었는데 공백기가 쌓이면 쌓일 수록 불안감이 느껴져 일병행하면서 준비하려고 중소기업 사무직을 많이 지원하게 되었습니다. 저에게 맞는 사무직렬은 총무직인 것 같아 여러군데 지원했는데 전부 탈락했습니다. 사기업+공기업 병행하며 서류를 넣기 시작하다보니 공백기가 어느덧 2년정도 되었습니다. 그러다보니까 이직준비도 점점 흔들리게 되네요. 제가 너무 능력이 없는 것 같아서 성격에는 조금 맞지 않지만 본업으로 그냥 돌아가야 할까 고민하고 있습니다. 목표를 한군데 정해놓고 제대로 하고 싶은데.. 유치원교사(or보육교사) vs 사무직 중 어느것이 가장 안정적이고 오래 일할 수 있을까요? 제가 가장 중요하게 생각하는 것은 안정성과 워라밸입니다! 참고로 스펙이라고 말하기도 부끄럽지만 유치원 경력 6개월, 컴퓨터 활용능력 1급, 워드 프로세서 1급, 한국사능력검정 1급 이렇게 가지고 있고, 어학성적은 640점을 가지고 있습니다.","비서 / 8년차 - 사람마다 틀리긴 하겠지만, 본업으로 돌아가도 또 현타가 올거라고 생각되네요. 고용노동부에서 지원해주는 국민내일배움카드 등을 활용하여 사무직에 필요한 자격증이나 프로그램 교육 등을 통해서 역량을 강화하면 중소기업 사무직에 충분히 합격할 수 있을 것 같습니다.",구매관리자 / 7년차 - 워라벨을 중요시하는 분이라면 사무직을 권해드리고 싶습니다 잘 찾아보면 급여가 조금적어도 워라벨이 가능한곳 충분히 많습니다. 유치원쪽은 워라벨을 시행하기 어려운것으로 알고있습니다. 말씀하신거처럼 퇴근 후에도 아이들관련하여 학부모들과 연락하여야하고 그러다보면 워라벨은 커녕 사람이 피폐해지기 마련입니다.,"사무담당자 / 25년차 - 저는 총무 업무만 25년 수행하고 퇴직을 하였습니다 총무쪽에 관심이 계신 것 같아 제가 아는 한도에서 답변 드리겠습니다 총무라는 명칭이 외부에서 볼 때는 무언가 레벨도 있어 보이고 파워도 있을거 같고 고상해 보일 수도 있을겁니다 하지만 총무 본 업은 한마디로 회사 살림꾼이며 파워나 고상스런 직은 아닙니다 직원들의 각종 복지 지원을 해주는 그런 직입니다 다만 회사 규모에 따라 다를수는 있습니다 중소기업 같은 곳은 `인사노무안전환경총무` 업무를 복합적으로 수행하기도 하는 것 같습니다 중소기업이상 회사에서는 총무 인사 노무 안전환경 업무 조직을 대부분 구분하여 운영한다고 보시면 됩니다 총무업무에는 회사 건물관리부터 지방세, 행사, 의전, 용역계약, 손님방문, 사택, 피복, 비품, 시설물, 사무실레이아웃, 사회공헌활동 회사경비, 청소, 식당, 문서, 사무용품, 우편물, 통신방송 , 복합기 관리 등 가지 수가 무수히 많습니다 그릫다고 전문적인 지식이나 기술을 꼭 필요로 하는 일도 아닙니다 누구나 조금만 배우면 하는 일들이죠 즉 전문성이 크지 않기 때문에 퇴직 이후에 그 업을 이어나가서 할 일이 없다는 것입니다 연구직이나 기술직 생산직에 비해 근무 수명도 짧을 수 있고요 그리고 다른 업무도 마찬가지겠지만 스트레스도 장난이 아닙니다 휴일날에도 출근해야하는 일도 종종 있고요 좀더 긍정적인 답변을 드려야 도움이 될텐데 너무 현실적인 이야기만 해드리는것 같네요 조직속에서의 직장 생활은 어디를 가더라도 힘들고 스트레스를 많이 받습니다 그 조직이 크면 클수록 강도는 더 쎄고요 그리고 내가 하는 일은 다 힘들고 남이 하는 일은 다 쉬워 보이는게 일반적인 느낌입니다 남의 떡이 더 커보인다는 말이 딱 맞는 말입니다 평생 직장 생활을 하는 것도 아니고 정년이 안되어도 적당한 나이가 되면 직장을 떠나야 하는게 사무직의 운명입니다 그게 현실입니다 그렇다면 직장을 떠나서도 이어서 할 수 있는 직업이 더 미래를 위한 투자라 생각됩니다 총무직은 그 투자가 아닌 것 같습니다",학원강사 / 4년차 - 사무직 추천합니다. 아이들 예쁜 것도 하루 이틀이지 학부모까지 상대하려면 정말 힘들고 내가 이렇게까지 해야하나 생각 많이 들어요.,"- 저도 유치원 교사 일년 채우고 바로 그만 뒀어요 워라벨이 없는 직업인 것 같아요 사무직 하세요,,",웹개발자 / 9년차 - 안정성과 워라밸이라면 공무원 외엔 답이 없습니다.,- 장기적인인 플랜을 마련하기에는 유치원 교사사 전망이 있다고 생각됩니다. 유치원 교사 경력을 10년 정도 체험 후 유치원 원장이 되는 것도 좋을 듯 합니다.,사무담당자 / 20년차 - 사견으로는 힘들겠지만 유치원교사를 계속 하는것이 나은거 같습니다.,온라인마케터 / 8년차 - 전공을 살리시는게 도움이 되실것 같습니다.사무직은 온라인이 대세인지라 해당 분야업무 능력요구하는 곳도 많구요. 경리직 말고는 급여가 오르기 쉽지않습니다. 보육교사는 자격증 필수라서 이분야에 어려움은 있겠으나 오래 근무할 수 있다는 장점이 있죠. 사무직은 정말 이직률이 높아요.,- 유치원교사(보육교사)보다 사무직이 더 안전할 것 같아요
2021-03-19 작성,"조회수 5,344",반도체엔지니어 / 에이에스엠엘코리아(주) / 동아대학교,외국계 반도체 장비업체 스펙,이번에 CS엔지니어에 관심이 있어서 찾아보고 있습니다. 그런데 스펙을 알기가 힘들더군요;; 특히 제가 학점이 3.37인데 CS엔지니어가 가능할까요?,"6년차 - 테그를 보니 ASML을 생각하고 계신가요? 많은 경우를 아는건 아니지만 외국 유명 대학 졸업하고 떨어진 분도 봤습니다. 또한, 듣기로 영어가 엄청 중요하다고 합니다. 그 회사 장비를 찾아보시면 알겠지만 반도체쪽 장비들 중에서 큰 편에 속한다고 생각 합니다. 그만큼 관리 해야 할 파트들이 많다는 의미고 교육에 있어 영어가 중요하다고 생각 됩니다. 그리도 관련 분야 전공을 중요시 하는 회사들도 있지만 가능성을 보고 채용 하는 회사들도 있으니 자신감을 갖고 도전해보세요. 외국어랑 운전 면허는 필수라고 생각합니다!!! 아 또한, 팀원들과 원만한 사회 생활을 해야 하죠. 또한, 장비 문제 해결이 주업무지만 필수적으로 고객을 상대하는 업무이기 때문에 고객과의 관계에 대한 것도 생각해야 합니다. 그러다보니 어쩔 수 없이 스트레스를 받는 경우도 발생 하지요. 공정에는 다양한 장비들이 사용 중이라 많이 찾아보시고 도전하세요. 경우에 따라서는 정말 바쁘고 힘든 회사도 있지만 그 만큼 보상도 따라오기도 합니다. 근데 이거는 회사마다 다르기 때문에 무조건 힘들다 편하다라고 할 수가 없어요. 출장의 경우도 마찬가지 입니다..... 반도체 분야 경우 빠른 대응을 위해 고객사 주변에 사무실을 운영하는 회사들도 있습니다. 모집 공고 보시면 알 수 있고 면접을 가게되면 잘 알아 보시고 본인에 맞는 회사를 찾으시면 좋겠네요. 저도 출장을 많이 다녀봤고 상주하는 것처럼 매일 가기도 했지만 개인 성향에 따라 좋아하기도 싫어하기도 합니다. 일을 하다보면 이직이라는 찬스도 있으니 잘 생각해보세요. 반도체관련 장비 회사 회사들은 매우 다양하게 많기 때문에 많이 알아 보시고 괜찮은 회사에 입사하길 바랍니다!","품질관리자 / 20년차 - 신입으로 입사한다면 학점도 평가 대상이겠지만 관련 자격증과 외국계 회사니 영어회화가 중요할 것으로 보이네요. 아무래도 하시려는 업무에 대한 마음가짐이 중요하지 않을까 하네요. 그리고 CS직군은 장비에 대한 폭넓은 지식이 중요하게 작용합니다. 기계설계, 제어, 프로세스에 대한 이해도가 높아야 되는데 이런건 실무를 하시면서 배우실 것으로 보입니다. 다만, 현장 필드 업무이다보니 출장 등에 의해 개인 생활 등에 영향을 미칠 수 있습니다. CS 업무에 장점은 장비에 대한 전체적인 전문지식을 배울 수 있는데 개인적으로 관련 공부를 많이 하셔야 5년 이후로 멋진 엔지니어가 되실 수 있을 것으로 보입니다. 저의 경우, 디스플레이 장비 공정 업무로 15년 해봤는데, CS 업무도 함께 경험을 했었는데, 잦은 출장이 힘이 들긴 했었네요.",반도체엔지니어 / 5년차 - CS엔지니어가 매우 힘든 직종입니다. 좀 더 알아보시고 선택해보세요,생산직종사자 / 17년차 - 학점말고 관련 자격증은?,"반도체엔지니어 / 2년차 - 현재 외국계 장비회사에서 연구개발하고 있습니다. 학점은 크게 중요한 요소가 아니라고 생각이 들기때문에 가능하다고 말씀드립니다. CS엔지니어는 보통 현장업무이기 때문에 체력이 중요합니다. 외국계 반도체 회사를 준비하시는거 같은데 일본계를 제외하면 대부분 영어면접이 있습니다. 영어+반도체 8대 공정 준비하시면 됩니다. 꾸준하게 운동하시고 기본적인 스펙을 쌓아가셨으면 합니다.(영어, 관련경험, 반도체 지식)",3년차 / 00학번 - 저도외국계기업알아보는데 경영학과전공인데스펙이궁금해요,기계엔지니어 / 3년차 - CS엔지니어는 학점이 3.37이 아니라 학점 2점대 중반이라도 가능하니 크게 걱정 하실 팔요가 없습니다.,인사담당자 / 10년차 - 지방거점국립대 3.5 800 6등급 정도로 보시면 됩니다. 단 영어 의사소통이 필요하고 반도체 공정지식을 요구하며 터프한 직무이다보니 성실성 긍정성 관계형성력 등의 태도를 봅니다.,,
2020-09-24 작성,"조회수 5,347",시설관리자,시설관리 직무에 연령제한이 있나요?,시설관리 직무에 회사에서 연령제한이 있나요?,시설관리자 / 22년차 - 열심히 하시면 정년이 없습니다,시설관리자 / 12년차 - 나이에 크게 상관은 없는데 너무 어리거나 나이가 많으면 보통 채용을 꺼리는 경향이 있는거 같네요..,시설관리자 / 15년차 - 회사나 특정 없체 마다 차이가 있을수 도 있습니다.,시설관리자 / 12년차 - 그렇습니다 회사규정이있어여,시설관리자 / 10년차 - 연령제한은 없습니다. 나이가 많을수록 그만큼 노력은 많이 해야 합니다.,시설관리자 / 14년차 - 다양한 연령층이 있습니다,시설관리자 / 3년차 - 50에 넘으면 신입으로 들어가긴 힘들죠,"전기기사 / 36년차 - 연령제한 하는 곳도 있습니다. 만65세이상 위탁관리회사에서 취업 어려움 있습니다. 나이를 이겨내기 위해 시설에 필요한 자격증을 갖추어야 합니다. 예) 전기분야 : 전기기사,전기산업기사전기기능장,전기기능사 앞에 2개 자격증 선임조건. 소방 자격증 소방설비기사(전기,기계),소방산업기사(전기,기계), 한국소방안전원 강습교육후 시험합격되면 됩니다.(소방안전관리자 특급,1급,2급, ) 저의 소견 소방안전관리자1급 추천 드립니다. 그럼 연령제한 돌파 할 수 있습니다. 화이팅 하세요!",6년차 - 나이보다는 맥가이버같은 손재주가 더 필요한듯...,시설관리자 / 32년차 - 저는 연령제한이 없어면 합니다
