작성일,조회수,직무명,질문 제목,질문 내용,답변 1,답변 2,답변 3,답변 4,답변 5,답변 6,답변 7,답변 8,답변 9,답변 10
2020-02-26 작성,"조회수 4,706",오산대학교,연봉협상 시기? 기준? 이 조금 이상한데요,저희 회사가 이번달에 연봉협상을 진행을했는데 1년이 넘어간 사람들만 대상으로 진행을했습니다. 매년 2월정도에 연봉협상을 한다고 들었는데 제가 4월입사라 이번에 못했는데 그럼 내년 2월까지 기다려야된다는 말이되는데 이런경우도 있나요??? 입사월 기준으로 연봉협상도아니고 해가넘어갈때 연봉협상하는것도 아니고 그럼 저는 다음 연봉협상까지 1년 10개월정도를 첫입사 시 연봉으로 받고 다녀야된다는 말인데요 이게 정상이라는 생각이 안들어서 이런경우가 있는지 여쭤봅니다.,7년차 / 09학번 - 입사시 작성한 근로계약서 혹은 연봉계약서에 연봉 만료일자가 있을겁니다 그거먼저 확인하고 HR에 문의하심이 좋을듯 하네요,4년차 / 15학번 - 없어요 그거안한다는겁니다,,,,,,,,
2019-02-22 작성,"조회수 4,703",원광대학교,사무직 취업이 안되요.,"저는 2018년 2월 경영학과를 졸업하고 3월부터 11월까지 조교를 하다가 지금 한참 취업준비를 하고 있습니다. 원하는 직무는 사무직인데 취업이 잘 안되요. 면접을 보러가면 신입은 안 뽑고 경력있는 사람만 뽑는 경우도 많구요.. 익산,전주,군산 쪽으로만 구하다 보니 일자리도 많이 없구..직무를 바꿔야 될까요? 지역을 다른 곳으로 알아봐야 될까요?? 고민입니다...","2년차 / 11학번 - 솔직히 저도 장교전역하고나서 여러 일을 해본다음 들어 올 수 있었던 곳이 사무영업직..입니다..... ㅋㅋㅋㅋ 경제학부인데도 이런데요 ㅠㅠ 타지역 충분히 알아보시고 경영학과시니 단순 총무, 사무보조 보단 경영지원/사무영업/잡매니저 등 사무쪽의 여러 분야를 정하시고 들어가시길 추천합니다. 자리는 많더라고요 ㅎㅎ","21년차 / 80학번 - 경영학과졸업으로는 일반행정직 취업문은 좁아요, 특히 지방에서는 취업문이 좁아요. 아직 늦지않았다면 본인사업을 생각해보면 어떨까요?",04학번 - 타지역으로 가싶시오. 그리고 컴퓨터 능력은 필수 입니다. 학교에서 배운건 아무 도움도 되지 않습니다. 지원하려는 회사에서 무슨 능력이 필요한지 모집공고를 잘보십시오. 일반적인 사무능력은 경리도 잘하니 모집공고를 잘 보고 경리와 차별되는 자신이 내세울수 있는 업무능력을 키워보세요.,"3년차 / 10학번 - 사무직 취업하고 싶었는데 다른쪽으로 가게 되었습니다.(사무직도 여러가지입니다.-인사,총무,생산관리,재무 등등) 이력서 100개정도 넣는다 싶은 마음으로 많이 넣으세요 직무 바꾸는것보다 다른 지역도 넓게 알아보시는게 더 좋을거 같습니다.",13학번 - 이 취업난에 전북만 고집한다는건.. 말이안되죠 계속 시도하다보면 될수도있지만 다른곳도 무조건 지원해보시고 갈지말지 또는 연봉은 충분한지 그때 생각해도 늦지않다고 생각합니다 면접은 많이볼수록 실력이 늘기때문에 그런 활동도 취업활동에 큰 도움이 될거라고생각합니다,"1년차 / 13학번 - 13학번입니다. 경영ㅠㅠ좋은 학과지만 취업 때는 진짜 막막하죠...ㅜㅜ 사무직이라고 두루뭉술하게 잡지말고 마케팅이면 마케팅, 영업이면 영업 쪽으로 진로를 잡으신 후에 구직을 하시는게 나을 것 같습니다. 또 관련 OA자격증은 가지고 계시는게 나을 것 같구요.. 물론 지금 취업난이 엄청나긴 하지만 지역적으로 전북쪽이 일자리가 많이 없는 것도 사실입니다. 여건이 되신다면 수도권쪽도 함께 알아보는 쪽이 좋을 것 같아요!",13년차 / 01학번 - 사무직은 막연하다 생각이 되네요 좀 더 구체적인 준비를 하시는게 좋을 듯 합니다. 사무직이라고 전문 분야가 없는 건 아니니까요. 한지역서만 직장을 찾는것 보다는 시야를 넓히는 것도 방법입니다. 하고 싶은 일을 먼저 찾으세요. 책상위에 앉아서 할 수 있는 일을 하고 싶어같은 막연함은 버리고. 회계나 관리 인사 등등 구체적으로 보시고 그에맞게 준비하세요. 취업자리가 없다 하지만 그건 가고 싶은 곳이 없는 거지 실제 취업자리가 없는게 아니니 눈을 살짝 낮춰 경력을 쌓는다 생각해도 좋을거 같네요.,"13년차 / 01학번 - 전.익.군 은 급여가짜고 업체도 공단에 몰려있어서 대기업1차 공장이거나 2차3차 중소기업임... 그중에 자동차쪽이나, 화학쪽, 외국계는 어학점수있음 지원가능하지만 일이 개많음.. 서울 경기는 급여조건은 괜찮지만 월세면 돈못모으고... 고생만함... OA자격증는 기본이고 여자면 회계자격증 추천, 이도저도 아니면 원어민수준 영어해서 외국계 추천드림... 아래 댓글처럼 특색이 있거나 자격증이 빵빵해야됨... 현실임...",2년차 / 10학번 - 네 전국구로 보셔야 해요 ㅠ 그리고 사무직은 경쟁율이 은근 세서 자격증 탄탄히 갖추시구여,
2020-08-26 작성,"조회수 4,704",구매관리자 / 경남대학교,유통관리사 2급 으로 연봉 얼마나 받을수 있을까요?,"제목과 같이 유통관리사 2급 자격증으로 이직을 한다면 해당 회사에서 연봉 얼마정도 받을수 있을까요? 물론 업무는 유통,물류 관련으로 하고",자재관리자 / 3년차 - 냉정하게 아무데도 쓸 데가 없습니다.,기술·전문강사 / 24년차 / 89학번 - 본인이 취업시 자격증과 관련되는 분야에서 근무를 하게 되면 경력과 함께 자격증의 가치가 증가 된다고 생각이 되며 꼭 관련되는 분야가 이니더라도 업무에서의 유사성이 있다면 취업시 도움이 된다고 생각 됩니다,생산직종사자 / 11년차 - 거의 대부분의 자격증이 입문혹은 가산점이 될수는 있어도 이직시 연봉산정기준이 될수는 없습니다 연봉은 자격보다는 경력이나 그동안의 실적을 보고주죠,인사담당자 / 10년차 - 유통관리사 2급은 취득 자체만으로 연봉을 예상할만한 가치가 있는 자격증이 아니기에 위 자격증을 기반으로 생각하시면 안된다는 점 말씀드려 봅니다.,해외영업 / 13년차 - 자격증만가지고 연봉을 측정하긴힘듭니다. 가시려는 곳에서 필요한 자격증인지를 확인해보시기 바랍니다.,구매관리자 / 6년차 - 취급해주는곳에서 취직이 유리 할 수 있지만 그걸로 연봉을 더 받지 않을겁니다. 경력+관련자격증이면 몰라도요,- 가산점이 되는거지 연봉을 더 올려주거나 이런 건 없는 자격증 같아요 단기간에 누구든 공부해서 딸 수 있는 자격증이니까요.. 유통관리사보다 물류관리사가 더 어려우니까 그걸 더 메리트 있게 보는 회사들도 많더라고요 유통보다,,,
2022-03-31 수정,"조회수 4,703",음식료·외식·프랜차이즈 / ㈜파리크라상,파리크라상 성남 생산직 질문,생산직 한 번 들어갈 생각이 있는데 궁금한게 있습니다. 1. 근무시간이 잘 지키나요? 2. 급여는 어느정도인가요? 3. 휴식및점심시간은 얼마나 주나요? 4.특근있나요? 5.연차및휴가는 사용하나요? 6.일이 힘든가요? 7.기숙사는 있나요?,"9년차 - 성남 파리크라상 질문 이시군요. 저도 개인빵집에 일하다가 파리크라상 들어가 일을했습니다. 1. 근무시간은 잘 지켜집니다. O.T 근무도 하고요. 2. 2교대라 세전 300은 찍으실껍니다. 복지포인트도 있고요. 3. 점심시간은 1시간 으로 알고있고 휴식시간은 글쎄.. 부서마다 틀려서.. 4. 특근?? 스케쥴근무라 특근이 없다고 봐야할듯 합니다. 주5일이나.. 평일날 쉴지.. 주말에 쉴지 모르기때문에 5. 유도리 있게 잘 사용하시면 되겠죠?? 사용은 할수있음. 6. 전국 식품회사 어딜가나 힘들어요. 적응하면 괜찮을수 있는데.. 적응안되고 일이 계속 힘들면 관두시는게... ㅋ 7. 회사에서 15분?? 거리에 기숙사 있습니다. 저 일할 당시 한방에 4명 썻는데. 개인 침대 사용하고요. 그랬었음. 그런데.. 꼭 한마디 해드리고 싶은말이 있어요. "" 도 망 쳐 "" 이상입니다.","전직장 - 작년에 파견으로 다녀왔습니다 . 1. 근무시간 굉장히 잘지켜줍니다. 2. 급여는 1교대 2교대 굉장히 다른데 일단 들어가시면 인턴 다른말로 저희는 파트너라고 부르는데 300만원 이상? 휴무는 월8번입니다 3. 휴식은 파트마다 다르기 때문에 뭐라 말씀을 드리기 어렵습니다. 노조에게 물어본걸로는 오전1번 오후 1번이고 점심시간은 1시간 그리고 준비가 필요하신 자리는 5분정도 일찍들어와 자기 자리 물건을 챙겨야하죠 4.특근이란 개념이 따로 없어용,,,2교대로 교대하고 바로 집감,,, 5.연차 1년이후에 발생하고 인턴때는 그런거 없음 휴가는 1년애 4알 공장과 스케줄 협의하고 갑니당 6. 일 굉장히 힘듬 ,,, 미쳤어 남자 여자애 따라 다름 하는일도 다르고 ,,,, 파견에도 불구하고 미친듯이 일시킴 ,, 일주일동안 힘들었어요 그이후는 살만함 근데 정말 돈이 필요하신거면 상관없는데 진짜 힘들어요 몸이 망가지는게 느껴진다고요,,, 7. 회사 15분거리에 있어요 그 성남 보건소 쪽에 언덕 미치는줄 여름에 그냥 땀으로 샤워 ,, 거기까지가는 버스도 없음. 4인실에 모든 물품은 각자 사용하고 분리수거도 각자 ! 기숙사 난 좋았는데. 저희다음으로 기숙사 쓰신분들은 텃세부린다고,,, 난리도 아님 ,,,",,,,,,,,
2022-11-07 수정,"조회수 4,744",그래픽디자이너,"그래픽, 디자인 직종에 40살 넘은 신입이 있나요?","40대 초반 남입니다. 중학교때부터 디자인, 특히 컴퓨터그래픽,CG쪽에 흥미를 가지고 그쪽으로 업을 삼겠다고 진로를 잡았습니다. 고3때 직업반을 선택해서 컴퓨터그래픽학과를 나오고 컴퓨터그래픽스운용기능사 자격증도 취득을 했는데 가난한 집에서 태어나서 당장 돈을 벌었어야했기에 대학진학은 꿈도 못꿨고, 고3때부터 일을 했습니다. 일해서 번돈을 모아서 3d 그래픽학원에서 공부를 했고 졸업과 포트폴리오를 잘 만들면 병역특례 업체도 알선해주겠다고 했는데 군입대 문제와 여러가지 사정때문에 졸업을 못하고 군입대를 하게 되었습니다. 제대후 몇번 이쪽의 일을 하려고 여러번 시도를 했었는데, 인생을 살다보면 내 마음대로 되는 일이 참 많이 없더군요. 그렇게 3d 그래픽,디자인과는 전혀 무관한 일만 해오다보니 나이가 이렇게 되어버렸습니다. 제 가슴속에 아직도 그래픽과 디자인쪽에서 일하고 싶은 열망이 있습니다. 20년넘게 직장생활하면서 단 한번도 일이 즐겁거나, 즐겁게 일을 한적이 없습니다. 하지만 이쪽계통에서 일을 한다면 박봉이여도 행복하게 일을 할 수 있을것 같습니다. 하고싶은 직종은 게임회사의 배경그래픽디자인쪽이나, 영화나 드라마 CG효과팀 또는 3d그래픽툴을 다루는 관련 직종에 일하고 싶은데 40살 넘은 신입이 들어온 사례가 있나요. 이게 미친 질문이라는건 충분히 압니다. 현업분들의 현실적인 조언이나 현재 그 동네 돌아가고 있는 상황같은것이 궁금합니다.","그래픽디자이너 / 5년차 - 인테리어 3D 및 영상 3D 회사에서 일했습니다. 신입으로 30살 중후반까지 채용하는 경우는 보았습니다. 물론 나이 때문에 뽑지 않으려고 했다가 상황이 급해서 채용한 케이스 입니다. 이력서 넣을려면 관련 포트폴리오를 제작 해야하는데 개인 공부 및 포트폴리오 제작 기간이 최소 1년 정도 예상 됩니다. 제 지인이 40살에 3D 공부 시작해서 취업이 안되니깐 2~3년 공부하고 개인 프리랜서로 활동 하고 있습니다. 물론 혼자서 공부는 어렵고 온라인 과외를 받으면서 공부했고 거의 1년에 500~600만원 지불하고 과외를 받았습니다. 3D 및 CG 업계가 야근이 많은 편입니다. 신입은 더 많겠죠. 하고 싶은 일을 하면 박봉이여도 행복하게 일 하면 좋겠지만, 집에 못하고 새벽에 퇴근해서 아침에 출근하는 신입도 있었습니다. 그런 부분 까지 고려해보시면 좋을 것 같습니다.",3년차 - 오래전이긴 하지만 국비로 학원다니던중에 같은 반에 40대이신분 봤었어요 누구보다 의지도 강하시고 열심히 하셨는데 수업이 끝날때쯤 영상쪽으로 취업하셨습니다 불가능한일은 아니에요 다만 저는 영상과 게임 관련 회사들을 둘 다 경험해봤는데 비슷하지만 많이 다릅니다 둘 중 한 분야를 선택해서 취업준비로 포폴을 만드시고 취업 후에 여유가 생겼을 시점에 선택하지 못했던 분야를 공부하신다면 장기적으로도 좋습니다. 두 분야가 사용하는 핵심프로그램과 워크플로우 그리고 가장 핵심적인 이유인 결과물 등이 매우 다르지만 만드는 방식은 비슷하기 때문에 크게 어렵지 않습니다. 추후에 공부 해두면 해당분야로 이직도 고려해 볼 수 도 있고 다른 분야에서 사용했던 기술을 응용해서 적용해보는 등의 일들을 하 실 수 있을 겁니다. 하지만 취업이 우선이기 때문에 반드시 한 가지 분야를 선택하셔서 포폴을 만드시는 것을 강조드리며 응원하며 물러나보겠습니다~~ 화이팅~~!,건축기사 / 9년차 - 도전하세요 어떠한 방법으로 시도하다보면 한분야에 바닥부터 시작한다는 업무 분야에 전문가가 되면 그분야에 새로운 도전창이 열리게 될것이라 믿습니다 희망을 놓지마세요! 저도 올해 47인데 그래픽전공 하여 전시분야에 전문으로 일 하고 있습니다 10년쯤 하다보니 다른분야에 관심이 있어 요식업을 하게되어 떡볶이 사업을 하게되었고 건축분야 목수가 되고싶어 목수가 되었습니다 인생은 하고싶은거 하고 살면 되는거라 어느 어르신이 말씀 하셨습니다 저또한 깨우친건 인생 중반에 접어들며 직업 귀천없다는걸 알게되었어요 어떤 직업이든 모두 적응하며 만족하고 행복하면 하면되는거서이고 직업은 모두 적응되면 똑같다는걸 알게 되었어요 항상 행복한 일 하며 사세요.,소프트웨어개발자 / 13년차 - 게임회사나 영화쪽 하실려면 실력이 탑급이여야 합니다 그렇다면 신입이어도 잘 없지만 가능은 합니다 디자이너라는게 실력을 위주로 보는 직종이다 보니까 충분히 가능하다고 봅니다 다시 말하지만 쉽게말해서 우리나라에 3d하는 사람이 3만명정도라면 300등안에 들어야 게임이나 영화cg하실수 있습니다,"광고디자이너 / 10년차 - 40대 신입은 본 적은 없지만,,, 과거에 그래픽 한번이라도 접한 경우,,, 40대 신입 가능합니다. 특히 남자이고 40대면 옥외광고디자인(간판 및 현수막 회사)가 현실적인 답변이겠어요. 옥외는 40대가 평균 나이거든요. 일러정도만 만지작거릴 줄 알고(포토는 기초정도) 출력까지 하신다면... 신입이더라도,,, 출력을 하니까 월250만원(지방기준)은 받으실 거예요... 단, 펀칭구멍 내는 일은 손조심하셔야 합니다.(손 다친 사람 있었다는 말이 있어서요.) 출력 안하면 그렇게 월급 못받구요.. 참고로 님과 비슷한 환경에서 게임회사에서 근무하시다가 40대에 옥외디자인으로 넘어오신 분 봤습니다. 게임회사가 과연 탄탄할까요? 그게 의문이에요. 제가 사는 지역은 게임회사, 애니메이션회사 월급 안주고 쌩고생에... 오래 있을 곳도 못되는데... 최소 제가 사는 지역은 그렇습니다. 아무튼 건승하길 빕니다.","PD·감독 / 6년차 - 보통 회사 CG작업자로 들어가기에 현실적으로 힘들겁니다, 무엇보다 자기 나갈 분야를 어느정도 잡아가야 할텐데 그거 알아가는데에만 몇년 걸릴수있죠. 박봉도 박봉이지만, 업계현실이 생각보다 시궁창같아서 정말 하기싫은 일이구나 라고 느낄수도있어요 (막상 어찌어찌 열악한 곳에 취업하게 된다 해도) 차라리 낮은 단가의 프리랜서로라도 살 자신이 있다면 한번 시작해볼만할수있겠습니다만... 그게 그럴 가치가 있을지는 판단하기 나름이니까요",- 전혀 미친질문 같지않아요 꿈에 대한 집념 멋있고 존경스러워요!! 포기하지마셔요 몇번 떨어진다고 낙담하지마시고 에이전시 공고 보이는족족 계속 다 이력서 넣으세요. 30대 후반 신입채용되는 경우 여럿 봤어요,웹디자이너 / 23년차 - 미친질문이라뇨. 언제나 도전은 훌륭한 일입니다. 40대 후반 UI/UX 쪽에 일하고 있습니다. 안타깝지만 제경험상 30대 중반이 신입으로서는 가장 나이가 있던 연령대였습니다. 무엇보다 그이상 연령대는 아래 실무자들이 힘들어 하다보니 아무래도 피하는 경향이 있습니다. 업체 규모보다는 인하우스 디자인 1인 체제 쪽으로 찾아보시길 권해드립니다.,5년차 - 저는 현재 cg쪽에서 일하고 있지는 않습니다. 2002~2010년까지 그쪽에 일을 했었는데 30대초중반의 신입을 본적은 있습니다. 나의 열정과 나이에 대한 고정관념이 없는회사라면 충분히 가능할거라 생각합니다.,
2021-10-01 작성,"조회수 4,719",솔루션·SI·CRM·ERP,공장 자동화 개발 신입으로 들어온 사람입니다.,"대학교 졸업후 20대 중반에 국비학원을 가야하나 취업을 빨리해야하나 방황하던 중 연락오는곳에 좀 섣부르게 취업을 했습니다. 공장 hmi를 사용하여 코딩을 하는 일이였고, 완전 자동화는 아니고 개발쪽으로 부서를 배정받아 C#을 이용해서 작업을 하더라구요. 원래는 java밖에 배우질 않았지만 거의 비슷한 문법과 구조때문에 적응은 빠르게 하여 괜찮았습니다. 물론 취업은 좋았지만 집에서 자차로 약 3시간거리에 있어서 기숙사를 제공받았고, 큰 명절이 아니면 집에 잘 가지 않았습니다. 입사 2주차부터 공부해라, 다른 프로젝트가 많다(다른 외주) 등 이유로 1만원수당을 주며 연장근무를 10시까지 하고있습니다.. 출근도 7시30분에 모여서 공장내로 들어간 후 5시 퇴근하고 10시까지 잔업을 핑계삼아 봐도 모르는 코드를 보고 잔업도 아닌 노트북 세팅 등 이런업무만 하고있네요.. 포괄임금제라 만원 주는거를 생색내듯이 말하고 이 때문에 하루 거의 15시간정도를 회사에만 있습니다.. 곧 수습기간 6개월을 다 채워가는 상황인데 어떻게 해야할 지 많이 고민됩니다.. 공장자동화가 안정적이라는 말은 많지만 저는 학원을가고싶은 생각도 들고 첫 직장을 너무 빨리 그만두어도 괜찮을까 하는 생각에 고민이 많이됩니다.. 긴 글 읽어주셔서 감사합니다",앱개발자 / 4년차 - 저도 제철쪽 대기업 자동화소프트웨어 개발자로 4년이 다되어가는데요 저희회사랑 거의 흡사할 정도로 비슷하네요 어찌보면 근처에 다른 회사 사람이거나 저희 회사 사람이 아닌가 싶을 정도로요..ㅎㅎ 솔직히 제가 님 연차나 나이로 다시 돌아간다면 이 직종 선택은 안할 것 같습니다 한국에 닷넷 위주의 일자리가 굉장히 없거든요 공장 자동화 경력 쌓아도 갈만한 회사가 그리 많지 않구요 저도 요즘들어 이직을 결심하고 알아보고 있는데 한국은 자바가 득세하고 닷넷은 대체로 스마트팩토리 키오스크 병원쪽 뭐 이런거밖에 없어서 일자리도 그렇게 많지 않을 뿐더러 이직도 쉽지가 않습니다 물론 적은 급여 꼬박꼬박 받고 안정적으로 경력 쌓아서 한 공장 공정의 흐름을 마스터하면 일하는게 굉장히 편해지겠지만 딱 거기서 끝이죠 요즘 추세가 죄다 자바 웹 IT서비스쪽 업무들에 대한 수요가 증가하고 그에따라 개발자들이 부족해지며 페이가 날로 치솟고 있습니다 자바 관련 직종에 가셔서 실력 쌓으시고 프리랜서로 전향하시는게 어떨지요 말을 주저리주저리 늘어놓다 보니 어떻게 썻나 싶네요 아무튼 제 지인이 공장자동화 SI 업체를 들어간다고 하면 저는 말릴것 같네여 시대의 흐름에 편승해서 자바 웹쪽으로 직종을 선택하여 넓은 시장에서 자신의 가치를 찾았으면 좋겠습니다,"21년차 - 프로그래머가 무슨 공장자동화를 본업으로 해요. 지금 단추를 잘못 끼웠어요. 거기다가 의미 없는 노동력 착취까지 당하시네요. 빨리 나와서 금융이던 공공이던 다른 프로젝트로 가세요. 업체도 다른 업체로 가시고.. 지금 처럼 일하면 고생만하고 돈도 못벌어요. 엘지나 삼성에서 하는 캠퍼스 수료 하시면, 관련된 업체에서 신입으로 연락갈꺼예요. 주변 신입들 이렇게 투입된 친구들이 몇몇 있습니다. 화이팅 하세요. 아직 시간은 많아요. 조바심 가질필요 없어요. 단추를 다시 끼우기를 추천합니다",출판·편집 / 7년차 - 국비학원은 기본 중에 기본만 알려준다고 생각하시면 될 것 같습니다 국비지원으로 배워도 같은 계열의 대학 나온 사람보다는 적으니까요 저라면 그대로 있거나 이직 준비를 할 것 같네요,,,,,,,
2021-02-20 작성,"조회수 4,718",앱개발자 / 전남대학교,이력서에 학점을 기재하는 게 좋을까요?,학점에 4.5 만점에 2.9인데 학점을 빼는 게 나을까요...?,IT·기술영업 / 6년차 - 필수 사항이 아니면 그냥 공란으로 해두는게 좋습니다. 궁금하면 면접때 물어볼 겁니다. 본인이 가지고 있는 장점을 부각시키는게 좋습니다,패션디자이너 / 1년차 - 빼세요.. 역량으로 공략하시는것이 ..,패션디자이너 / 15년차 - 빼요 ~알면서 넣는건 바보애요,,,,,,,
